{
  "card_version": 1,
  "agent_id": "spec",
  "name": "spec",
  "role": "spec",
  "description": "",
  "capabilities": [
    "req_clarify",
    "spec_draft"
  ],
  "input_modalities": [
    "text",
    "file"
  ],
  "output_modalities": [
    "text",
    "file"
  ],
  "tools": [],
  "skills": [],
  "subscriptions": [
    {
      "topic": "t-stats",
      "event_types": [
        "status_update",
        "result",
        "review_result"
      ]
    }
  ],
  "workspace": "agents/spec/",
  "created_at": "2026-09-14T10:13:10.271264+00:00",
  "updated_at": "2026-09-14T10:45:51.124731+00:00"
}