{
  "card_version": 1,
  "agent_id": "qa",
  "name": "qa",
  "role": "qa",
  "description": "",
  "capabilities": [
    "review",
    "verify"
  ],
  "input_modalities": [
    "text",
    "file"
  ],
  "output_modalities": [
    "text",
    "file"
  ],
  "tools": [],
  "skills": [],
  "subscriptions": [
    {
      "topic": "t-stats",
      "event_types": [
        "status_update",
        "review_request",
        "review_result"
      ]
    }
  ],
  "workspace": "agents/qa/",
  "created_at": "2026-09-14T10:13:10.476270+00:00",
  "updated_at": "2026-09-14T10:45:51.128169+00:00"
}