{
  "card_version": 1,
  "agent_id": "architect",
  "name": "Architect",
  "role": "architect",
  "description": "架构与接口：技术选型、模块/接口划分、数据模型",
  "capabilities": [
    "design",
    "architecture",
    "review-plan"
  ],
  "input_modalities": [
    "text",
    "file"
  ],
  "output_modalities": [
    "text",
    "file"
  ],
  "tools": [
    "read",
    "grep",
    "glob",
    "bash",
    "teamctl"
  ],
  "skills": [
    "architecture"
  ],
  "subscriptions": [
    {
      "topic": "planning",
      "event_types": [
        "task_assigned"
      ]
    },
    {
      "topic": "design",
      "event_types": [
        "task_assigned",
        "result"
      ]
    }
  ],
  "workspace": "agents/architect/",
  "created_at": "2026-09-18T04:33:35.696353+00:00",
  "updated_at": "2026-09-18T04:33:35.696381+00:00"
}