{
  "card_version": 1,
  "agent_id": "dev",
  "name": "dev",
  "role": "dev",
  "description": "",
  "capabilities": [
    "coding",
    "test"
  ],
  "input_modalities": [
    "text",
    "file"
  ],
  "output_modalities": [
    "text",
    "file"
  ],
  "tools": [],
  "skills": [],
  "subscriptions": [
    {
      "topic": "t-stats",
      "event_types": [
        "task_assigned",
        "status_update"
      ]
    }
  ],
  "workspace": "agents/dev/",
  "created_at": "2026-09-14T10:13:10.373060+00:00",
  "updated_at": "2026-09-14T10:45:51.126621+00:00"
}